{
  "anchor_ids": [
    "anchor_architecture",
    "anchor_character",
    "anchor_landscape",
    "anchor_object",
    "anchor_portrait"
  ],
  "candidate_vector_id": "vec_optical_softness",
  "date": "2026-08-13",
  "decision": "linear_partial",
  "decision_reason": "The weighted prompt moved all five anchors toward softness plus some darkening plus glow. Linear combination is a usable first-order control. Residual bloom and invented eye/sun lights show the linear model is incomplete, but not yet enough to require a tensor term. Record pairwise notes and keep the model linear.",
  "entanglement_notes": [
    "Softness and bloom still co-occur in the reconstruction.",
    "Shadow density under-expresses relative to its isolated high pole."
  ],
  "hold_constant": [
    "subject identity",
    "pose and blocking",
    "framing and crop",
    "camera height and distance",
    "key light direction",
    "scene content",
    "source image when editing"
  ],
  "id": "study_reconstruction_soft_halated_shadow_001",
  "levels": [
    "reconstruction"
  ],
  "next_experiments": [
    "Raise only shadow density after a soft reconstruction (sequential, not simultaneous).",
    "Fit weights by comparing reconstruction scores to isolated high poles."
  ],
  "notes": "target=aes_soft_halated_shadow",
  "observation_ids": [
    "obs_0051",
    "obs_0052",
    "obs_0053",
    "obs_0054",
    "obs_0055"
  ],
  "protocol": "Translate aesthetic weights into prompt phrases and edit each anchor.",
  "status": "complete",
  "title": "Linear reconstruction of aes_soft_halated_shadow"
}
